{
 "contract": 1,
 "fixture": "real-home-01",
 "lang": "ru",
 "bss": [
  {
   "bssid": "98:d8:63:a0:00:1c",
   "ssid": "net-01",
   "hidden": false,
   "vendor": "",
   "random_mac": false,
   "band": "2.4",
   "channel": 6,
   "center": 6.0,
   "width": 20,
   "rssi": -92,
   "quality": 9,
   "security": "Open",
   "ciphers": [],
   "akm": [],
   "pmf": "",
   "wps": false,
   "gen": "legacy",
   "gen_n": 0,
   "streams": 0,
   "phy": "legacy",
   "mcs": null,
   "nss": 1,
   "rate": 54.0,
   "bss_color": null,
   "k": false,
   "nr": false,
   "r": false,
   "v": false,
   "std": {},
   "mdid": null,
   "util": null,
   "stations": null,
   "country": "",
   "beacon": 100,
   "dtim": null,
   "cap": "0x0401",
   "ht_prot": 0,
   "ie_len": 21,
   "ie_tree": [
    {
     "id": 0,
     "name": "SSID",
     "len": 6,
     "summary": "net-01",
     "fields": [
      [
       "SSID",
       "net-01"
      ]
     ],
     "hex": "6e 65 74 2d 30 31"
    },
    {
     "id": 1,
     "name": "Supported Rates",
     "len": 8,
     "summary": "1* 2* 5.5* 11* 9 18 36 54 Мбит/с",
     "fields": [
      [
       "Скорости (* = basic)",
       "1* 2* 5.5* 11* 9 18 36 54 Мбит/с"
      ]
     ],
     "hex": "82 84 8b 96 12 24 48 6c"
    },
    {
     "id": 3,
     "name": "DS Parameter Set",
     "len": 1,
     "summary": "канал 6",
     "fields": [
      [
       "Канал",
       "6"
      ]
     ],
     "hex": "06"
    }
   ]
  },
  {
   "bssid": "1c:af:f7:a0:00:2d",
   "ssid": "net-02",
   "hidden": false,
   "vendor": "",
   "random_mac": false,
   "band": "2.4",
   "channel": 6,
   "center": 6.0,
   "width": 20,
   "rssi": -89,
   "quality": 18,
   "security": "WPA1-Personal",
   "ciphers": [
    "TKIP"
   ],
   "akm": [],
   "pmf": "",
   "wps": true,
   "gen": "legacy",
   "gen_n": 0,
   "streams": 0,
   "phy": "legacy",
   "mcs": null,
   "nss": 1,
   "rate": 54.0,
   "bss_color": null,
   "k": false,
   "nr": false,
   "r": false,
   "v": false,
   "std": {},
   "mdid": null,
   "util": null,
   "stations": null,
   "country": "",
   "beacon": 100,
   "dtim": 1,
   "cap": "0x0411",
   "ht_prot": 0,
   "ie_len": 218,
   "ie_tree": [
    {
     "id": 0,
     "name": "SSID",
     "len": 6,
     "summary": "net-02",
     "fields": [
      [
       "SSID",
       "net-02"
      ]
     ],
     "hex": "6e 65 74 2d 30 32"
    },
    {
     "id": 1,
     "name": "Supported Rates",
     "len": 8,
     "summary": "1* 2* 5.5* 11* 18 24 36 54 Мбит/с",
     "fields": [
      [
       "Скорости (* = basic)",
       "1* 2* 5.5* 11* 18 24 36 54 Мбит/с"
      ]
     ],
     "hex": "82 84 8b 96 24 30 48 6c"
    },
    {
     "id": 3,
     "name": "DS Parameter Set",
     "len": 1,
     "summary": "канал 6",
     "fields": [
      [
       "Канал",
       "6"
      ]
     ],
     "hex": "06"
    },
    {
     "id": 5,
     "name": "TIM",
     "len": 4,
     "summary": "DTIM period 1",
     "fields": [
      [
       "DTIM count",
       "0"
      ],
      [
       "DTIM period",
       "1"
      ]
     ],
     "hex": "00 01 00 00"
    },
    {
     "id": 42,
     "name": "Element 42",
     "len": 1,
     "summary": "",
     "fields": [
      [
       "Данные",
       "00"
      ]
     ],
     "hex": "00"
    },
    {
     "id": 47,
     "name": "Element 47",
     "len": 1,
     "summary": "",
     "fields": [
      [
       "Данные",
       "00"
      ]
     ],
     "hex": "00"
    },
    {
     "id": 50,
     "name": "Extended Supported Rates",
     "len": 4,
     "summary": "6 9 12 48 Мбит/с",
     "fields": [
      [
       "Скорости (* = basic)",
       "6 9 12 48 Мбит/с"
      ]
     ],
     "hex": "0c 12 18 60"
    },
    {
     "id": 221,
     "name": "Vendor Specific",
     "len": 14,
     "summary": "WPS",
     "fields": [
      [
       "OUI",
       "00-50-F2 (Microsoft)"
      ],
      [
       "Тип",
       "4 (WPS)"
      ]
     ],
     "hex": "00 50 f2 04 10 4a 00 01 10 10 44 00 01 02"
    },
    {
     "id": 221,
     "name": "Vendor Specific",
     "len": 5,
     "summary": "Microsoft type 5",
     "fields": [
      [
       "OUI",
       "00-50-F2 (Microsoft)"
      ],
      [
       "Тип",
       "5 (Microsoft type 5)"
      ]
     ],
     "hex": "00 50 f2 05 00"
    },
    {
     "id": 221,
     "name": "Vendor Specific",
     "len": 9,
     "summary": "OUI 00-10-18, тип 2",
     "fields": [
      [
       "OUI",
       "00-10-18"
      ],
      [
       "Тип",
       "2"
      ],
      [
       "ASCII",
       "....."
      ],
      [
       "Hex",
       "00 f0 00 00 00"
      ]
     ],
     "hex": "00 10 18 02 00 f0 00 00 00"
    },
    {
     "id": 221,
     "name": "Vendor Specific",
     "len": 24,
     "summary": "WPA (WPA1)",
     "fields": [
      [
       "OUI",
       "00-50-F2 (Microsoft)"
      ],
      [
       "Тип",
       "1 (WPA (WPA1))"
      ],
      [
       "AKM",
       "PSK"
      ],
      [
       "Шифры",
       "TKIP"
      ]
     ],
     "hex": "00 50 f2 01 01 00 00 50 f2 02 01 00 00 50 f2 02 01 00 00 50 f2 02 00 00"
    },
    {
     "id": 221,
     "name": "Vendor Specific",
     "len": 117,
     "summary": "WPS",
     "fields": [
      [
       "OUI",
       "00-50-F2 (Microsoft)"
      ],
      [
       "Тип",
       "4 (WPS)"
      ]
     ],
     "hex": "00 50 f2 04 10 4a 00 01 10 10 44 00 01 02 10 41 00 01 00 10 3b 00 01 03 10 47 00 10 00 00 78 00 00 78 00 00 78 00 00 00 00 00 78 00 10 21 00 06 78 78 78 78 78 78 10 23 00 07 78 78 78 78 78 78 78 10 24 00 07 78 78 78 78 78 78 78 10 42 00 08 78 78 78 78 78 78 78 78 10 54 00 08 00 06 00 50 f2 04 00 01 10 11 00 07 78 78 78 78 78 78 78 10 08 00 02 00 8e"
    }
   ]
  },
  {
   "bssid": "d6:a0:00:00:03:03",
   "ssid": "net-03",
   "hidden": false,
   "vendor": "",
   "random_mac": true,
   "band": "5",
   "channel": 60,
   "center": 50.0,
   "width": 160,
   "rssi": -89,
   "quality": 18,
   "security": "WPA2-Personal",
   "ciphers": [
    "CCMP"
   ],
   "akm": [
    "PSK",
    "FT-PSK"
   ],
   "pmf": "no",
   "wps": true,
   "gen": "Wi-Fi 6",
   "gen_n": 6,
   "streams": 2,
   "phy": "HE",
   "mcs": 11,
   "nss": 2,
   "rate": 2402.0,
   "bss_color": 54,
   "k": true,
   "nr": true,
   "r": true,
   "v": true,
   "std": {
    "d": "страна RU",
    "e": "WMM",
    "h": "Power Constraint 0 дБ, TPC Report 19 дБм",
    "i": "PSK, FT-PSK",
    "k": "neighbor report",
    "r": "MDID 0x5F45",
    "v": "BTM",
    "twt": "TWT responder"
   },
   "mdid": 24389,
   "util": 1.6,
   "stations": 2,
   "country": "RU",
   "beacon": 100,
   "dtim": 1,
   "cap": "0x1811",
   "ht_prot": 1,
   "ie_len": 371,
   "ie_tree": [
    {
     "id": 0,
     "name": "SSID",
     "len": 6,
     "summary": "net-03",
     "fields": [
      [
       "SSID",
       "net-03"
      ]
     ],
     "hex": "6e 65 74 2d 30 33"
    },
    {
     "id": 1,
     "name": "Supported Rates",
     "len": 8,
     "summary": "6* 9 12* 18 24* 36 48 54 Мбит/с",
     "fields": [
      [
       "Скорости (* = basic)",
       "6* 9 12* 18 24* 36 48 54 Мбит/с"
      ]
     ],
     "hex": "8c 12 98 24 b0 48 60 6c"
    },
    {
     "id": 3,
     "name": "DS Parameter Set",
     "len": 1,
     "summary": "канал 60",
     "fields": [
      [
       "Канал",
       "60"
      ]
     ],
     "hex": "3c"
    },
    {
     "id": 5,
     "name": "TIM",
     "len": 4,
     "summary": "DTIM period 1",
     "fields": [
      [
       "DTIM count",
       "0"
      ],
      [
       "DTIM period",
       "1"
      ]
     ],
     "hex": "00 01 00 00"
    },
    {
     "id": 7,
     "name": "Country",
     "len": 12,
     "summary": "RU",
     "fields": [
      [
       "Код страны",
       "RU"
      ]
     ],
     "hex": "52 55 04 24 08 14 84 04 17 95 05 17"
    },
    {
     "id": 32,
     "name": "Power Constraint (802.11h)",
     "len": 1,
     "summary": "0 дБ",
     "fields": [
      [
       "Снижение мощности относительно лимита страны",
       "0 дБ"
      ]
     ],
     "hex": "00"
    },
    {
     "id": 35,
     "name": "TPC Report (802.11h)",
     "len": 2,
     "summary": "TX 19 дБм",
     "fields": [
      [
       "Мощность передачи",
       "19 дБм"
      ],
      [
       "Link margin",
       "0 дБ"
      ]
     ],
     "hex": "13 00"
    },
    {
     "id": 195,
     "name": "Element 195",
     "len": 5,
     "summary": "",
     "fields": [
      [
       "Данные",
       "03 2f 2f 2f 2f"
      ]
     ],
     "hex": "03 2f 2f 2f 2f"
    },
    {
     "id": 70,
     "name": "RM Enabled Capabilities (802.11k)",
     "len": 5,
     "summary": "neighbor report да",
     "fields": [
      [
       "Neighbor report",
       "да"
      ],
      [
       "Сырой байт",
       "0x02"
      ]
     ],
     "hex": "02 00 01 00 00"
    },
    {
     "id": 51,
     "name": "Element 51",
     "len": 3,
     "summary": "",
     "fields": [
      [
       "Данные",
       "81 32 72"
      ]
     ],
     "hex": "81 32 72"
    },
    {
     "id": 54,
     "name": "Mobility Domain (802.11r)",
     "len": 3,
     "summary": "MDID 0x5F45",
     "fields": [
      [
       "MDID",
       "0x5F45"
      ],
      [
       "FT over DS",
       "нет"
      ]
     ],
     "hex": "45 5f 00"
    },
    {
     "id": 48,
     "name": "RSN",
     "len": 24,
     "summary": "PSK, FT-PSK; CCMP",
     "fields": [
      [
       "Групповой шифр",
       "CCMP"
      ],
      [
       "Pairwise",
       "CCMP"
      ],
      [
       "AKM",
       "PSK, FT-PSK"
      ],
      [
       "PMF capable (MFPC)",
       "нет"
      ],
      [
       "PMF required (MFPR)",
       "нет"
      ]
     ],
     "hex": "01 00 00 0f ac 04 01 00 00 0f ac 04 02 00 00 0f ac 02 00 0f ac 04 00 00"
    },
    {
     "id": 221,
     "name": "Vendor Specific",
     "len": 54,
     "summary": "WPS",
     "fields": [
      [
       "OUI",
       "00-50-F2 (Microsoft)"
      ],
      [
       "Тип",
       "4 (WPS)"
      ]
     ],